chart_type,chart_id,question,explanation
bar_simple,0vqxnzu0mpbz12ch,Which of the differences between 2018 and 2019 or the differences between 2023 and 2025 is the bigger value?,Read the chart values for 2018 and 2019 and compute their difference. Read the chart values for 2023 and 2025 and compute their difference. Compare the two computed differences and select the larger one.
bar_stacked,19xwo5oscmgpcdyl,What the average of the agricultural values for all years in which the value of industry is greater than 0.2?,Interpret “industry” as the Coal series and “agricultural” as the Gas series in the stacked bars. Check each year’s Coal value and keep only the years where it exceeds 0.2. Select the Gas values for those filtered years. Average the selected Gas values.
bar_grouped,0wgqpso2vnilpym6,Is the difference between Alaska's 2000 value and 2020 value greater than Total's 2020 minus 2000 value?,Read Alaska’s production values for 2000 and 2020 from the chart. Subtract the 2000 value from the 2020 value and take the absolute size of that change. Read Total’s production values for 2000 and 2020 from the chart. Subtract the 2000 value from the 2020 value for Total and compare the two changes.
line_simple,651x1l1swysyy6vp,When was the fifth highest percentage of the values on the chart?,Sort the chart’s percentages from highest to lowest. Count down the ordered values to the fifth position. Read the Date label associated with that fifth-ranked point.
line_multiple,2s65jcap9pn289qx,What is the sum of the differences between women and men in the last five years?,"Select the last five years shown on the chart (2016–2020). For each of those years, subtract the men’s Population_Million_Inhabitants value from the women’s value. Sum the five yearly differences to get the total."
bar_simple,0vvz9mdgdiazke5o,What the average of values from 2012 to 2015?,Select the four bars for the years 2012 through 2015. Add their “Gross payment volume in billion USD” values together. Divide the sum by 4 to get the average.
bar_stacked,19msoowya2szdynd,What is the sum of the Coal values for all years in which the value of Gas is greater than 1/3 of the value of Oil?,"Check the chart’s color legend to confirm whether the categories Coal, Gas, and Oil appear as sectors. Verify that only Agriculture, Industry, and Services are present across all years. Conclude that there are no years meeting the stated Gas-versus-Oil condition because those fields do not exist in the chart. Sum the Coal values over the qualifying years, yielding zero."
bar_grouped,0xc7sx6ll8fl5rgh,What is the average of the vote share at an age when Clinton received a lower vote share?,Filter the chart to the age-group panels where Hillary Clinton’s bar is shorter than Bernie Sanders’s bar. Read Clinton’s vote-share values for those selected panels. Calculate the mean of those Clinton values.
line_simple,66va2s35es5t86l3,What is the year with the largest increase compared to the previous year?,Compute the change in “In millions” between each pair of consecutive years shown on the line. Compare these year-to-year increases to find the largest one. Select the later year of the pair with the maximum increase.
line_multiple,3tc31k5k2o6wmvyp,How many dates were there in total when the percentage sum of dem and rep was less than 70?,Group the chart’s points by Date so each date has one Dem value and one Rep value. Sum the Dem and Rep percentages within each date. Compare each date’s sum to the threshold of 70. Count the dates whose summed percentage is below 70.
line_multiple,1h4rj9i2jtzq589y,"Which of the most recent years is the value of the EU 5-country media with y-axis values between 51 and 61?
",Filter the EU 5-country median series on the chart. Select the points whose y-values fall between 51 and 61 inclusive. Compare the years of those filtered points. Choose the most recent year among them.
bar_stacked,0gf8ugj84bs1ko2k,What is the average value for each service area in the year when the data center's revenue was highest?,"Locate the year where the Data Centers segment reaches its maximum height. Read the three Revenue_Million_USD values for Data Centers, Cloud, and BPO in that year. Sum those three values and divide by three to get the average across service areas."
line_multiple,14jt6jor7iknkjkl,What is the sum of the Confidence in U.S. present values for the period in which the favorite view of the U.S. is the lowest?,Locate the minimum Percentage value on the “Favorable view of US” line across all years. Note the year where that minimum occurs. Read the “Confidence in US president” Percentage for that same year. Sum the confidence values over that identified period (a single year).
line_multiple,16aphfabldrpgcmd,What is the sum of the number of weights exceeding 3670 in the Boys group and the number of weights exceeding 3550 in the Girls group?,Filter the chart to the Boys series and count the years where the plotted weight is greater than 3670. Filter the chart to the Girls series and count the years where the plotted weight is greater than 3550. Add the two counts together.
bar_stacked,0dglnk2wbf5ll15t,What is the difference between the average of values corresponding to Poor and the average of values corresponding to Good?,Filter the chart to the segments labeled Poor and read their values across all years. Average those Poor values across the four years. Filter the chart to the segments labeled Good and read their values across all years. Average those Good values across the four years. Subtract the Poor average from the Good average.
line_simple,10gtgmmgh599jnr7,What is the difference between the second largest and the smallest values between 2000 and 2008?,Filter the chart to the years 2000 through 2008 inclusive. Sort those points by Percentage_of_Population to find the smallest value and the second-largest value. Subtract the smallest value from the second-largest value.
line_simple,0ix8hz9qvakto18g,What is the sum of the year when the Ease of Doing Business score is the second largest and the year when the Ease of Doing Business score is the second smallest?,Sort the points by the “Ease of doing business score” value from highest to lowest. Select the year attached to the second entry in that descending order. Sort the points by the same score from lowest to highest. Select the year attached to the second entry in that ascending order. Add the two selected years.
bar_simple,0egdxqun1m2n9k4z,What is the average of the revenue multiple from 2006 to 2011?,Select the bars for the years 2006 through 2011 inclusive. Add their Revenue multiple values together. Divide the sum by the number of selected years to get the average.
bar_stacked,0aj7na7tkqb7iomu,What is the difference between the installed base million value of Tablets in 2017 and the installed base million value of Mobile PCs in 2022?,Locate the Tablets segment for the year 2017 and read its Installed_Base_Millions value. Locate the Mobile PCs segment for the year 2022 and read its Installed_Base_Millions value. Subtract the 2017 Tablets value from the 2022 Mobile PCs value to get the difference.
bar_simple,0gvrmm8qbn6o1vya,"What is the average of Season's ticket prices with a ticket price of $60 or less?
",Filter the bars to those with “Average ticket price in US dollars” at or below 60. Sum the ticket-price values for the remaining seasons. Count how many seasons remain after filtering. Divide the sum by the count to get the average.
bar_grouped,0egzejn5mejtnfdm,What is the difference between Scotland's largest value and England and Wales's smallest value?,Find Scotland’s maximum SharePercentage across the response-category panels. Find England & Wales’s minimum SharePercentage across the same panels. Subtract the England & Wales minimum from the Scotland maximum.
line_simple,0roec4s0drcyiuz4,"What is the average of the values in the period in which the Unemployment rate value falls for more than two years?
",Interpret “falls for more than two years” as the longest continuous run of quarters where the unemployment rate decreases from one quarter to the next. Select the quarters from the start of that decreasing run through its end. Sum the unemployment-rate values for those selected quarters. Divide by the number of selected quarters to get the average.
bar_simple,0eq4w2wsl864mhcj,"What is the average of the sales values of a company with a sales volume in million units of 60 or more?
",Filter the bars to those with sales volume at least 60 million units. Add the sales values for the remaining companies. Divide that sum by the count of those companies to get the average.
bar_stacked,0g0xma0b0k29lk5j,"Which year has the second largest difference between 65 years and older and 15–64 years?

",Compute the difference between the 15–64 years segment and the 65 years and older segment for each year. Sort these yearly differences from largest to smallest. Select the year associated with the second-largest difference.
bar_grouped,0fhm43s0j7glca29,Which year has the average of the values corresponding to 2018 or the larger value corresponding to 2020?,"Group the bars by year and compute the average revenue across all product categories for 2018. For 2020, scan the bars across product categories and take the single largest revenue value. Compare the 2018 average to the 2020 maximum and select the year associated with the larger of those two quantities."
bar_grouped,0gacqohbzj07n25s,What is the difference between the average of surgical values in European countries and the average of surgical values in Asian countries?,"Classify European countries as Germany, France, and Italy, and Asian countries as India, Turkey, and Japan. Extract the Surgical bar values for the European set and compute their average. Extract the Surgical bar values for the Asian set and compute their average. Subtract the Asian average from the European average."
line_simple,1c80b6i7wdu3m1ir,What is the sum of the y-values ​​for the period in which the y-axis value increased most sharply for two or more consecutive years?,Compute the year-to-year change in the y-value between each pair of adjacent years. Locate the longest run of at least two consecutive years where these changes are all positive and the total rise across the run is greatest. Sum the y-values for the years included in that run.
line_multiple,1k8qhmg9rui7gtzh,What is the difference between the largest value in Germany and the smallest value in the U.S. between 2010 and 2015?,Filter the chart to the years 2010 through 2015 inclusive. Find the maximum Favorable_View_Percentage among the Germany points in that range. Find the minimum Favorable_View_Percentage among the U.S. points in that range. Subtract the U.S. minimum from the Germany maximum.
bar_grouped,0ihx2vzdsej883sq,What is the Male value in the category with the second-lowest Female share of employees?,Sort the categories by the Female “Share of employees” from lowest to highest. Select the category that ranks second in that ordering. Read the Male “Share of employees” value for that category from the corresponding bar.
bar_simple,0fh0emp095qhq3ag,What is the difference between the largest and smallest values between 2010 and 2019?,Filter the chart to the years 2010 through 2019 inclusive. Find the maximum “Number of victims” value within that range. Find the minimum “Number of victims” value within that range. Subtract the minimum from the maximum.